{"description":"Drive the Trellis administration client's contract-declared platform access.","displayName":"Trellis Console","format":"trellis.participant.v1","id":"trellis-app.console@v1","implements":{"self":{"api":"trellis-app.console@v1","apiDigest":"FGQ9yeQpdADleg1-h5t_kS8DvpWVM2wGT0FgWXCKGJE"}},"kind":"app","uses":{"required":{"trellis_auth_v1":{"api":"trellis.auth@v1","apiDigest":"6k2TZ2r6d0H2y9qB-6y2PsCvJ9kq5KFlGvVOqM0nAEw","rpc":{"call":["Auth.Capabilities.List","Auth.CapabilityGroups.Delete","Auth.CapabilityGroups.Get","Auth.CapabilityGroups.List","Auth.CapabilityGroups.Put","Auth.Connections.Kick","Auth.Connections.List","Auth.DeploymentAuthority.AcceptMigration","Auth.DeploymentAuthority.AcceptUpdate","Auth.DeploymentAuthority.Get","Auth.DeploymentAuthority.List","Auth.DeploymentAuthority.Plan","Auth.DeploymentAuthority.Plans.Get","Auth.DeploymentAuthority.Plans.List","Auth.DeploymentAuthority.Reconcile","Auth.DeploymentAuthority.Reject","Auth.Deployments.Create","Auth.Deployments.Disable","Auth.Deployments.Enable","Auth.Deployments.List","Auth.Deployments.Remove","Auth.DeviceUserAuthorities.List","Auth.DeviceUserAuthorities.Reviews.Decide","Auth.DeviceUserAuthorities.Reviews.List","Auth.DeviceUserAuthorities.Revoke","Auth.Devices.ConnectInfo.Get","Auth.Devices.Disable","Auth.Devices.Enable","Auth.Devices.List","Auth.Devices.Provision","Auth.Devices.Remove","Auth.IdentityAuthority.Get","Auth.IdentityAuthority.List","Auth.IdentityAuthority.Revoke","Auth.IdentityGrants.List","Auth.IdentityGrants.Revoke","Auth.Portals.Get","Auth.Portals.GrantOverrides.List","Auth.Portals.GrantOverrides.Put","Auth.Portals.GrantOverrides.Remove","Auth.Portals.List","Auth.Portals.LoginSettings.Get","Auth.Portals.LoginSettings.Update","Auth.Portals.Put","Auth.Portals.Remove","Auth.Portals.Routes.Put","Auth.Portals.Routes.Remove","Auth.ServiceInstances.Disable","Auth.ServiceInstances.Enable","Auth.ServiceInstances.List","Auth.ServiceInstances.Provision","Auth.ServiceInstances.Remove","Auth.Sessions.List","Auth.Sessions.Logout","Auth.Sessions.Me","Auth.Sessions.Revoke","Auth.UserIdentities.List","Auth.Users.Create","Auth.Users.Get","Auth.Users.IdentityLink.Create","Auth.Users.List","Auth.Users.Password.Change","Auth.Users.PasswordReset.Create","Auth.Users.Resolve","Auth.Users.Update"]}},"trellis_eventlog_v1":{"api":"trellis.eventlog@v1","apiDigest":"0dHI0vCQ_7EhGPQY10aK_hc5cEnnwdPIZrSIjwo7Nwg","feeds":{"subscribe":["EventLog.Watch"]},"rpc":{"call":["EventLog.Consumers.Inspect","EventLog.Consumers.Query","EventLog.Inspect","EventLog.Metrics","EventLog.Query"]}},"trellis_health_v1":{"api":"trellis.health@v1","apiDigest":"8GFaxY8gvKvagqRIF43iaRpUN_40ukCylk_nwmFaZkg","events":{"subscribe":["Health.StatusChanged"]},"feeds":{"subscribe":["Health.Watch"]},"rpc":{"call":["Health.Inspect","Health.Metrics","Health.Query"]}},"trellis_jobs_v1":{"api":"trellis.jobs@v1","apiDigest":"PE0Zr_66Vaypj1-XksXfaDOViTirdGw6DuoaKpWtFXs","feeds":{"subscribe":["Jobs.Watch"]},"rpc":{"call":["Jobs.Cancel","Jobs.DismissDLQ","Jobs.GetKey","Jobs.Inspect","Jobs.ListDLQ","Jobs.ListServices","Jobs.Metrics","Jobs.Query","Jobs.ReplayDLQ","Jobs.Retry"]}},"trellis_state_v1":{"api":"trellis.state@v1","apiDigest":"1WHxeF9WLJh3v-mmHiV5mql3a67tmPNpEUFxxUIF9-Y","rpc":{"call":["State.Admin.Delete","State.Admin.Get","State.Admin.List"]}}}}}
