{"description":"Trellis built-in app for authenticated device activation over the Auth.DeviceUserAuthorities.Resolve operation.","displayName":"Trellis Device Activation","format":"trellis.participant.v1","id":"trellis-app.portal@v1","implements":{"self":{"api":"trellis-app.portal@v1","apiDigest":"DReps_YCRCgd9JCCgTEKtxr7S9AunoqhMR-cz-rObg4"}},"kind":"app","uses":{"required":{"trellis_auth_v1":{"api":"trellis.auth@v1","apiDigest":"6k2TZ2r6d0H2y9qB-6y2PsCvJ9kq5KFlGvVOqM0nAEw","operations":{"invoke":["Auth.DeviceUserAuthorities.Resolve"],"observe":["Auth.DeviceUserAuthorities.Resolve"]}}}}}
