{"description":"Activated Field Device TUI for the consolidated demo.","displayName":"Field Device Demo","docs":{"markdown":"Declares the Field Device demo's service usage and local state for selected sites and draft inspections.","summary":"Activated field device demo."},"format":"trellis.participant.v1","id":"demo.device@v1","implements":{"self":{"api":"demo.device@v1","apiDigest":"mEmDg58k8Xb_TdI_j8-cQK5KsPvLzxdYD3Hmm0O4yL8"}},"kind":"device","schemas":{"DraftInspectionState":{"properties":{"checklistName":{"type":"string"},"inspectionId":{"type":"string"},"notes":{"type":"string"},"siteId":{"type":"string"},"updatedAt":{"type":"string"}},"required":["inspectionId","siteId","checklistName","notes","updatedAt"],"type":"object"},"SelectedSiteState":{"properties":{"selectedAt":{"type":"string"},"siteId":{"type":"string"},"siteName":{"type":"string"}},"required":["siteId","siteName","selectedAt"],"type":"object"}},"state":{"draftInspections":{"docs":{"markdown":"Stores editable inspection draft notes keyed by inspection id.","summary":"Draft inspection state."},"kind":"map","schema":{"schema":"DraftInspectionState"},"stateVersion":"draft-inspection.v1"},"selectedSite":{"docs":{"markdown":"Stores the active site selected in the device TUI.","summary":"Selected site state."},"kind":"value","schema":{"schema":"SelectedSiteState"},"stateVersion":"selected-site.v1"}},"uses":{"required":{"fieldOps":{"api":"demo.service@v1","apiDigest":"qu_P04zYsryJycTKpriGBJIOAZ9N0xDwYZj8p9BR8eg","events":{"subscribe":["Audit.Recorded","Evidence.Uploaded","Reports.Published","Sites.Refreshed"]},"operations":{"cancel":["Reports.Generate"],"invoke":["Evidence.Upload","Reports.Generate","Sites.Refresh"],"observe":["Evidence.Upload","Reports.Generate","Sites.Refresh"]},"rpc":{"call":["Assignments.List","Evidence.Download","Evidence.List","Sites.Get","Sites.List"]}},"state":{"api":"trellis.state@v1","apiDigest":"1WHxeF9WLJh3v-mmHiV5mql3a67tmPNpEUFxxUIF9-Y","rpc":{"call":["State.Delete","State.Get","State.List","State.Put"]}}}}}
