{"description":"Trellis built-in app for authenticated device activation over the Auth.DeviceUserAuthorities.Resolve operation.","displayName":"Trellis Device Activation","format":"trellis.participant.v1","id":"trellis.portal.activation@v1","kind":"app","uses":{"required":{"trellis.auth@v1":{"api":"trellis.auth@v1","apiDigest":"k-AVuZetf28XCxaYc2HEIzbafPeA63WeRgg0YmHtia0","operations":{"cancel":["Auth.DeviceUserAuthorities.Resolve"],"invoke":["Auth.DeviceUserAuthorities.Resolve"],"observe":["Auth.DeviceUserAuthorities.Resolve"]}}}}}