{"description":"Caller for the service walkthrough.","displayName":"Orders caller","format":"trellis.participant.v1","id":"acme.orders-caller","implements":{"self":{"api":"acme.orders-caller@v1","apiDigest":"YyZR1x1FTKntHUadRY4zF_iUdi_ekGixH5zKBcyq7nA"}},"kind":"app","uses":{"required":{"orders":{"api":"acme.orders@v1","apiDigest":"ZtW5mgePiJGXRVFh4rKCoV7LAUh7-P1AVExLWcl74iM","rpc":{"call":["Orders.Create"]}}}}}
