{"description":"Minimal service walkthrough.","displayName":"Orders","format":"trellis.participant.v1","id":"acme.orders-service","implements":{"self":{"api":"acme.orders@v1","apiDigest":"ZtW5mgePiJGXRVFh4rKCoV7LAUh7-P1AVExLWcl74iM"}},"kind":"service","schemas":{"CreateOrderRequest":{"properties":{"customerId":{"type":"string"}},"required":["customerId"],"type":"object"},"CreateOrderResponse":{"properties":{"customerId":{"type":"string"},"orderId":{"type":"string"}},"required":["orderId","customerId"],"type":"object"}}}
