{"description":"Browser console for the consolidated Field Ops demo.","displayName":"Field Ops Console","docs":{"markdown":"Declares the browser app's Field Ops service usage and workspace context state.","summary":"Field operations browser console."},"format":"trellis.participant.v1","id":"demo.app@v1","implements":{"self":{"api":"demo.app@v1","apiDigest":"6TMQOitxUWuQ3REsNhxR1kf3hKyxSDlNr-6cTzjgqK8"}},"kind":"app","schemas":{"InspectionContextState":{"properties":{"note":{"type":"string"},"siteId":{"type":"string"},"updatedAt":{"type":"string"},"updatedBy":{"type":"string"}},"required":["siteId","note","updatedBy","updatedAt"],"type":"object"}},"state":{"workspaceContext":{"docs":{"markdown":"Stores per-workspace inspection context used by the browser console.","summary":"Workspace context state."},"kind":"map","schema":{"schema":"InspectionContextState"},"stateVersion":"inspection-context.v1"}},"uses":{"required":{"fieldOps":{"api":"demo.service@v1","apiDigest":"qu_P04zYsryJycTKpriGBJIOAZ9N0xDwYZj8p9BR8eg","feeds":{"subscribe":["Audit.Feed"]},"operations":{"cancel":["Reports.Generate"],"invoke":["Evidence.Upload","Reports.Generate","Sites.Refresh"],"observe":["Evidence.Upload","Reports.Generate","Sites.Refresh"]},"rpc":{"call":["Assignments.List","Evidence.Delete","Evidence.Download","Evidence.List","Reports.List","Sites.Get","Sites.List"]}},"state":{"api":"trellis.state@v1","apiDigest":"1WHxeF9WLJh3v-mmHiV5mql3a67tmPNpEUFxxUIF9-Y","rpc":{"call":["State.Delete","State.Get","State.List","State.Put"]}}}}}
