{"description":"Caller-owned state.","displayName":"Runtime caller","format":"trellis.participant.v1","id":"test.denied","implements":{"self":{"api":"test.client@v1","apiDigest":"o8El02dTOgwoMQysX9wgZj3Tp4RHGljAroEj0Q1fGPw"}},"kind":"app","schemas":{"Saved":{"properties":{"value":{"type":"string"}},"required":["value"],"type":"object"}},"uses":{"optional":{"runtime":{"api":"test.runtime@v1","apiDigest":"5CesKi4xQWw2TuBSzOaf_eF6_h9iUxh9SrYRfc6yK78","rpc":{"call":["Echo"]}}}}}
