{"description":"Admin participant used by live Trellis integration tests.","displayName":"Trellis Test Admin","format":"trellis.participant.v1","id":"test.admin","implements":{"self":{"api":"test.admin@v1","apiDigest":"5P5LEUZUAXsjyxXET1FRblEv0_v-mXtMczmF2zDDOaU"}},"kind":"app","uses":{"required":{"auth":{"api":"trellis.auth@v1","apiDigest":"6k2TZ2r6d0H2y9qB-6y2PsCvJ9kq5KFlGvVOqM0nAEw","rpc":{"call":["Auth.CapabilityGroups.Put","Auth.Connections.List","Auth.DeploymentAuthority.AcceptMigration","Auth.DeploymentAuthority.AcceptUpdate","Auth.DeploymentAuthority.Get","Auth.DeploymentAuthority.List","Auth.DeploymentAuthority.Plan","Auth.DeploymentAuthority.Plans.List","Auth.DeploymentAuthority.Reconcile","Auth.DeploymentAuthority.Reject","Auth.Deployments.Create","Auth.Devices.Provision","Auth.IdentityAuthority.List","Auth.IdentityAuthority.Revoke","Auth.Portals.Get","Auth.Portals.GrantOverrides.Put","Auth.Portals.GrantOverrides.Remove","Auth.Portals.List","Auth.Portals.LoginSettings.Update","Auth.Portals.Put","Auth.Portals.Routes.Put","Auth.ServiceInstances.Provision","Auth.Sessions.Revoke","Auth.UserIdentities.List"]}},"eventlog":{"api":"trellis.eventlog@v1","apiDigest":"0dHI0vCQ_7EhGPQY10aK_hc5cEnnwdPIZrSIjwo7Nwg","rpc":{"call":["EventLog.Query"]}},"health":{"api":"trellis.health@v1","apiDigest":"8GFaxY8gvKvagqRIF43iaRpUN_40ukCylk_nwmFaZkg","rpc":{"call":["Health.Query"]}},"jobs":{"api":"trellis.jobs@v1","apiDigest":"PE0Zr_66Vaypj1-XksXfaDOViTirdGw6DuoaKpWtFXs","rpc":{"call":["Jobs.Query"]}},"state":{"api":"trellis.state@v1","apiDigest":"1WHxeF9WLJh3v-mmHiV5mql3a67tmPNpEUFxxUIF9-Y","rpc":{"call":["State.Admin.Delete","State.Admin.Get","State.Admin.List"]}}}}}
