{"description":"Distinct publisher authority on one consumer.","displayName":"Durable event acceptance","eventConsumers":{"events":{"events":{"self":["Alpha","Beta"]}}},"format":"trellis.participant.v1","id":"test.events","implements":{"self":{"api":"test.events@v1","apiDigest":"D2ZBsIpJt42ku6yDI4xFynOUY2UI7YkxadXfTqQpm0g"}},"kind":"service","schemas":{"Empty":{"properties":{},"type":"object"},"Observed":{"properties":{"values":{"items":{"type":"string"},"type":"array"}},"required":["values"],"type":"object"},"Sample":{"properties":{"site":{"type":"string"},"value":{"type":"string"}},"required":["site","value"],"type":"object"}}}
