{"description":"Caller-owned state.","displayName":"Runtime caller","format":"trellis.participant.v1","id":"test.beta","implements":{"self":{"api":"test.client@v1","apiDigest":"o8El02dTOgwoMQysX9wgZj3Tp4RHGljAroEj0Q1fGPw"}},"kind":"app","schemas":{"Saved":{"properties":{"value":{"type":"string"}},"required":["value"],"type":"object"}},"uses":{"required":{"events":{"api":"test.events@v1","apiDigest":"D2ZBsIpJt42ku6yDI4xFynOUY2UI7YkxadXfTqQpm0g","events":{"publish":["Beta"]}}}}}
