{"description":"Rust-owned platform participant that implements authentication, bootstrap, and auth callout.","displayName":"Trellis Auth Runtime","format":"trellis.participant.v1","id":"trellis-auth-runtime","implements":{"auth":{"api":"trellis.auth@v1","apiDigest":"5mA4JP4Q8b3V_-vVUaoQ6mE48SBy-vXazNzNGlAeq5A"}},"kind":"service","resources":{"kv":{"browserFlows":{"maxValueBytes":65536,"purpose":"Store short-lived browser authentication and activation flow state.","schema":{"schema":"AuthBrowserFlow"},"ttlMs":86400000},"connections":{"maxValueBytes":16384,"purpose":"Track current operational NATS connection presence.","schema":{"schema":"AuthConnectionPresence"},"ttlMs":120000},"oauthStates":{"maxValueBytes":16384,"purpose":"Store CAS-consumed OAuth state, PKCE, and unknown-outcome recovery records.","schema":{"schema":"AuthOAuthState"},"ttlMs":900000}}},"schemas":{"AuthBrowserFlow":{"properties":{"claimOwner":{"type":["string","null"]},"claimedAt":{"maximum":9007199254740991,"minimum":0,"type":["integer","null"]},"completedAt":{"maximum":9007199254740991,"minimum":0,"type":["integer","null"]},"createdAt":{"maximum":9007199254740991,"minimum":0,"type":"integer"},"durableResultDigest":{"pattern":"^[A-Za-z0-9_-]{43}$","type":["string","null"]},"expiresAt":{"maximum":9007199254740991,"minimum":0,"type":"integer"},"flowId":{"minLength":1,"type":"string"},"format":{"const":"trellis.auth-browser-flow.v1"},"kind":{"enum":["user_auth","device_activation"]},"participantArtifactDigest":{"pattern":"^[A-Za-z0-9_-]{43}$","type":"string"},"participantId":{"minLength":1,"type":"string"},"participantNeedsDigest":{"pattern":"^[A-Za-z0-9_-]{43}$","type":"string"},"portalId":{"minLength":1,"type":"string"},"principalId":{"type":["string","null"]},"redirectTarget":{"type":["string","null"]},"requestDigest":{"pattern":"^[A-Za-z0-9_-]{43}$","type":"string"},"requestId":{"minLength":1,"type":"string"},"sessionNkey":{"minLength":1,"type":"string"},"sessionPublicKey":{"minLength":1,"type":"string"},"state":{"enum":["choose_provider","authenticated","approval_required","approval_denied","approved","consumed","expired"]},"version":{"maximum":9007199254740991,"minimum":1,"type":"integer"}},"required":["format","flowId","kind","state","requestId","requestDigest","participantId","participantArtifactDigest","participantNeedsDigest","sessionPublicKey","sessionNkey","portalId","redirectTarget","principalId","claimOwner","claimedAt","durableResultDigest","completedAt","createdAt","expiresAt","version"],"type":"object"},"AuthConnectionPresence":{"properties":{"clientId":{"minLength":1,"type":"string"},"connectedAt":{"maximum":9007199254740991,"minimum":0,"type":"integer"},"connectionId":{"minLength":1,"type":"string"},"format":{"const":"trellis.auth-connection-presence.v1"},"lastSeenAt":{"maximum":9007199254740991,"minimum":0,"type":"integer"},"remoteAddress":{"type":["string","null"]},"serverId":{"minLength":1,"type":"string"},"sessionId":{"minLength":1,"type":"string"},"userNkey":{"minLength":1,"type":"string"},"version":{"maximum":9007199254740991,"minimum":1,"type":"integer"}},"required":["format","connectionId","sessionId","serverId","clientId","userNkey","remoteAddress","connectedAt","lastSeenAt","version"],"type":"object"},"AuthOAuthState":{"properties":{"claimOwner":{"type":["string","null"]},"createdAt":{"maximum":9007199254740991,"minimum":0,"type":"integer"},"expiresAt":{"maximum":9007199254740991,"minimum":0,"type":"integer"},"flowId":{"minLength":1,"type":"string"},"format":{"const":"trellis.auth-oauth-state.v1"},"kind":{"enum":["browser","account_flow"]},"nonce":{"minLength":1,"type":"string"},"pkceVerifier":{"minLength":1,"type":"string"},"providerId":{"minLength":1,"type":"string"},"redirectUri":{"minLength":1,"type":"string"},"resultDigest":{"pattern":"^[A-Za-z0-9_-]{43}$","type":["string","null"]},"stateId":{"minLength":1,"type":"string"},"status":{"enum":["pending","claimed","exchange_started","completed","restart_required","expired"]},"version":{"maximum":9007199254740991,"minimum":1,"type":"integer"}},"required":["format","stateId","providerId","kind","flowId","status","pkceVerifier","nonce","redirectUri","claimOwner","resultDigest","createdAt","expiresAt","version"],"type":"object"}}}
