{"description":"Small generated transport and durability fixture.","displayName":"Runtime acceptance","eventConsumers":{"events":{"events":{"self":["Changed"]}}},"format":"trellis.participant.v1","id":"test.provider","implements":{"self":{"api":"test.runtime@v1","apiDigest":"5CesKi4xQWw2TuBSzOaf_eF6_h9iUxh9SrYRfc6yK78","operationTransfers":{"Upload":{"expiresInMs":60000,"key":"/value","store":"files"}}}},"jobQueues":{"work":{"payload":{"schema":"Value"},"result":{"schema":"Value"}}},"kind":"service","resources":{"store":{"files":{"maxObjectBytes":262144,"purpose":"Transfer acceptance bytes."}}},"schemas":{"Empty":{"properties":{},"type":"object"},"Value":{"properties":{"value":{"type":"string"}},"required":["value"],"type":"object"}}}
