{"description":"Caller-owned state.","displayName":"Runtime caller","format":"trellis.participant.v1","id":"test.caller","implements":{"self":{"api":"test.client@v1","apiDigest":"o8El02dTOgwoMQysX9wgZj3Tp4RHGljAroEj0Q1fGPw"}},"kind":"app","schemas":{"Saved":{"properties":{"value":{"type":"string"}},"required":["value"],"type":"object"}},"state":{"saved":{"kind":"value","schema":{"schema":"Saved"},"stateVersion":"saved.v1"}},"uses":{"required":{"runtime":{"api":"test.runtime@v1","apiDigest":"5CesKi4xQWw2TuBSzOaf_eF6_h9iUxh9SrYRfc6yK78","events":{"subscribe":["Changed"]},"feeds":{"subscribe":["Watch"]},"operations":{"invoke":["Upload","Work"],"observe":["Upload","Work"]},"rpc":{"call":["Echo"]}},"state":{"api":"trellis.state@v1","apiDigest":"1WHxeF9WLJh3v-mmHiV5mql3a67tmPNpEUFxxUIF9-Y","rpc":{"call":["State.Delete","State.Get","State.List","State.Put"]}}}}}
